{
  "id": "research",
  "title": "Research",
  "summary": "Core question: does Ferrum use less memory, CPU and energy than Chrome and Edge for the same work without being slower or less reliable, and does smart tab sleeping help? Nothing measured yet. See our [promises](ref:ov-research-plan), [fairness rules](ref:ov-research-fairness-protocol) and [what could fool us](ref:ov-research-threats-to-validity).",
  "questions": [
    {
      "id": "rq-01",
      "title": "Memory and CPU versus browsers",
      "summary": "We count only the processes each product starts itself, so nothing is missed or counted twice.",
      "status": "Open, no data yet",
      "category": "Research question",
      "tags": [
        "memory",
        "CPU"
      ],
      "phase": "phase-p6-benchmark-harness",
      "related": [
        "hyp-01",
        "hyp-02",
        "hyp-03",
        "exp-baseline-footprint"
      ],
      "source": {
        "wiki_path": "wiki/research/questions/rq-01-resource-footprint.md",
        "content_hash": "sha256:4c3955c53ab713549183b9dc71eb4f41b895a8f4963832d6c782b0792d5551bc"
      },
      "question": "Does Ferrum, with no tab sleeping, use less memory and CPU than Chrome, Edge and a bare-bones Tauri app on the same test pages?"
    },
    {
      "id": "rq-02",
      "title": "Speed: startup, page loads, smoothness",
      "summary": "Ferrum puts each tab in its own embedded web view and checks every navigation, which could add delay.",
      "status": "Open, no data yet",
      "category": "Research question",
      "tags": [
        "benchmarks",
        "web views"
      ],
      "phase": "phase-p6-benchmark-harness",
      "related": [
        "hyp-04",
        "hyp-05",
        "hyp-06",
        "exp-startup",
        "exp-navigation",
        "exp-rendering"
      ],
      "source": {
        "wiki_path": "wiki/research/questions/rq-02-responsiveness.md",
        "content_hash": "sha256:b4ed050ee0175907396fc9e5ff7f63724e6dc598b5c1591f069c15dcd025aaa3"
      },
      "question": "Does showing websites inside Ferrum make startup, page loads or scrolling slower than in Chrome, Edge or the bare-bones app?"
    },
    {
      "id": "rq-03",
      "title": "Energy use",
      "summary": "The AMD chip's energy counter is a model, not a meter. If it fails our checks, energy is reported as not measurable, never guessed.",
      "status": "Open, no data yet",
      "category": "Research question",
      "tags": [
        "CPU",
        "benchmarks"
      ],
      "phase": "phase-p6-benchmark-harness",
      "related": [
        "hyp-07",
        "exp-energy"
      ],
      "source": {
        "wiki_path": "wiki/research/questions/rq-03-energy.md",
        "content_hash": "sha256:295c9dacef3b2cb52d4646ff866da7d5e3e595b9d73fd253307949f54e824868"
      },
      "question": "Can we measure energy honestly on this AMD desktop and, if so, does Ferrum use less energy per task than Chrome and Edge?"
    },
    {
      "id": "rq-04",
      "title": "Smart tab sleeping (the central question)",
      "summary": "Tab sleeping means pausing or unloading tabs you are not using. Scored with the overall score J. Similar ideas exist, so nothing is claimed as new before the literature review.",
      "status": "Open, no data yet",
      "category": "Research question",
      "tags": [
        "tab sleeping",
        "paper"
      ],
      "phase": "phase-p7-lifecycle",
      "related": [
        "hyp-08",
        "hyp-09",
        "hyp-10",
        "hyp-11",
        "exp-lifecycle-policies",
        "metric-objective-j"
      ],
      "source": {
        "wiki_path": "wiki/research/questions/rq-04-lifecycle-policies.md",
        "content_hash": "sha256:182a33f4a1772a3b99284bd7b29aeaba1be0b82def7c2fac6355c05fdc29a54d"
      },
      "question": "Does a smart tab-sleeping policy balance memory, energy and tab wake-up time better than no sleeping or a simple timer, without ever unloading a tab it must keep?"
    },
    {
      "id": "rq-05",
      "title": "Cost of the security checks",
      "summary": "The checks-off build exists only for this test and is never shipped. Whether the checks work is tested separately.",
      "status": "Open, no data yet",
      "category": "Research question",
      "tags": [
        "blocklist",
        "benchmarks"
      ],
      "phase": "phase-p6-benchmark-harness",
      "related": [
        "hyp-12",
        "exp-security-overhead"
      ],
      "source": {
        "wiki_path": "wiki/research/questions/rq-05-security-overhead.md",
        "content_hash": "sha256:0abb67115309189314bd23d492141fb7d5fc23e4103d9c3aa337bf7d9ab4f442"
      },
      "question": "How much delay and memory do Ferrum's site-blocking and permission checks add, compared with the same build with the checks switched off?"
    },
    {
      "id": "rq-06",
      "title": "Cost of keeping sites apart",
      "summary": "Alternatives: one shared profile, or one data folder per site. We must list exactly what stays shared. It depends on per-site profiles working in Ferrum (an open risk).",
      "status": "Open, no data yet",
      "category": "Research question",
      "tags": [
        "isolation",
        "memory"
      ],
      "phase": "phase-p6-benchmark-harness",
      "related": [
        "hyp-13",
        "exp-isolation-overhead"
      ],
      "source": {
        "wiki_path": "wiki/research/questions/rq-06-isolation.md",
        "content_hash": "sha256:c3b388d23d194b6537332411bf403488cc83d9bb5c06c956abe251cdc0d713a8"
      },
      "question": "With one WebView2 profile per site, what is still shared, and how much extra memory and processes does it cost versus the alternatives?"
    },
    {
      "id": "rq-07",
      "title": "Reliability over long use",
      "summary": "Covers memory creep over long runs, crashes, crash recovery and session restore.",
      "status": "Open, no data yet",
      "category": "Research question",
      "tags": [
        "memory",
        "tabs"
      ],
      "phase": "phase-p6-benchmark-harness",
      "related": [
        "hyp-14",
        "hyp-15",
        "exp-reliability"
      ],
      "source": {
        "wiki_path": "wiki/research/questions/rq-07-reliability.md",
        "content_hash": "sha256:3ea1ede1a9b7faeb5e48f25c7ff629340b6648fcde48a45d95460af6b141a23c"
      },
      "question": "Does Ferrum stay as stable as Chrome and Edge over hours of use, and does it restore sessions and recover from tab crashes and network drops?"
    }
  ],
  "hypotheses": [
    {
      "id": "hyp-01",
      "title": "Ferrum uses less memory than Chrome and Edge",
      "summary": "Counts as a real win only if the gap is at least 10% (proposed). Memory means private memory, added up over all the product's processes.",
      "status": "Draft, not tested",
      "category": "Prediction",
      "tags": [
        "memory",
        "benchmarks"
      ],
      "phase": "phase-p6-benchmark-harness",
      "related": [
        "rq-01",
        "exp-baseline-footprint",
        "metric-tree-private-commit",
        "metric-tree-private-working-set",
        "metric-process-count"
      ],
      "source": {
        "wiki_path": "wiki/research/hypotheses/hyp-01-idle-memory-vs-browsers.md",
        "content_hash": "sha256:c17598d8b819e55e29f297c7121a1a94886ef3d413b4ef1252ead657d7f3aa78"
      },
      "prediction": "We expect Ferrum (no tab sleeping) to use less memory than Chrome and Edge as shipped, on an idle page and on 4 active tabs; we would be wrong if its typical use is equal or higher."
    },
    {
      "id": "hyp-02",
      "title": "Ferrum adds little on top of a bare-bones Tauri app",
      "summary": "A 'not worse than' test with a 20% margin (proposed), judged on the cautious end of the 95% confidence range.",
      "status": "Draft, not tested",
      "category": "Prediction",
      "tags": [
        "Tauri",
        "memory"
      ],
      "phase": "phase-p6-benchmark-harness",
      "related": [
        "rq-01",
        "exp-baseline-footprint",
        "metric-tree-private-commit",
        "metric-tree-cpu-time"
      ],
      "source": {
        "wiki_path": "wiki/research/hypotheses/hyp-02-overhead-vs-tauri-baseline.md",
        "content_hash": "sha256:abd53a88e4b0ceb35fea2ff4693b61c3c38ca24a217c177d6eaac96ae1ee240b"
      },
      "prediction": "We expect Ferrum's idle memory to be less than 20% above a bare-bones Tauri app showing the same page; we would be wrong if the extra could be 20% or more."
    },
    {
      "id": "hyp-03",
      "title": "Without tab sleeping, Ferrum burns more background CPU",
      "summary": "Chrome and Edge freeze or sleep background tabs by default; Ferrum without sleeping does not. Counts at a 10% gap (proposed). This motivates the tab-sleeping work.",
      "status": "Draft, not tested",
      "category": "Prediction",
      "tags": [
        "CPU",
        "tab sleeping"
      ],
      "phase": "phase-p6-benchmark-harness",
      "related": [
        "rq-01",
        "exp-baseline-footprint",
        "metric-tree-cpu-time",
        "metric-tree-cpu-cycles"
      ],
      "source": {
        "wiki_path": "wiki/research/hypotheses/hyp-03-background-cpu-without-lifecycle.md",
        "content_hash": "sha256:81385c9f554cf100fa98938f5f5c88ede4c58eb5fab47438a44d03fa104262ff"
      },
      "prediction": "We expect Ferrum without tab sleeping to use more CPU per minute on 20 background tabs than Chrome and Edge; we would be wrong if it uses the same or less."
    },
    {
      "id": "hyp-04",
      "title": "Ferrum opens its window faster",
      "summary": "Counts if at least 10% and 50 ms faster (proposed). Edge's pre-launch 'Startup Boost' is switched off so the race is fair.",
      "status": "Draft, not tested",
      "category": "Prediction",
      "tags": [
        "benchmarks",
        "web views"
      ],
      "phase": "phase-p6-benchmark-harness",
      "related": [
        "rq-02",
        "exp-startup",